{
  "$schema": "https://json-schema.org/draft/2020-12/schema",
  "$id": "https://evidencepress.org/protocols/api/v2/pilot-task-bank.schema.json",
  "title": "Frozen feasibility-pilot task bank",
  "description": "A manifest of difficulty-matched task blocks. It contains hashes and identifiers, not raw company documents or answer keys.",
  "type": "object",
  "additionalProperties": false,
  "required": ["schema_version", "pilot_id", "study_stage", "task_bank_id", "version", "synthetic_example", "frozen_at", "frozen_by_role", "blocks"],
  "properties": {
    "schema_version": { "const": "2.0" },
    "pilot_id": { "type": "string", "pattern": "^[a-z0-9][a-z0-9-]{2,63}$" },
    "study_stage": { "const": "feasibility" },
    "task_bank_id": { "type": "string", "pattern": "^[a-z0-9][a-z0-9-]{2,63}$" },
    "version": { "type": "string", "pattern": "^\\d+\\.\\d+\\.\\d+$" },
    "synthetic_example": { "type": "boolean" },
    "frozen_at": { "type": "string", "pattern": "^\\d{4}-\\d{2}-\\d{2}T\\d{2}:\\d{2}:\\d{2}Z$" },
    "frozen_by_role": { "type": "string", "minLength": 3 },
    "blocks": {
      "type": "array",
      "minItems": 3,
      "maxItems": 3,
      "items": {
        "type": "object",
        "additionalProperties": false,
        "required": ["block_id", "difficulty_stratum", "block_sha256", "tasks"],
        "properties": {
          "block_id": { "type": "string", "pattern": "^B[0-9A-Z_-]{2,31}$" },
          "difficulty_stratum": { "type": "string", "minLength": 3 },
          "block_sha256": { "type": "string", "pattern": "^[a-f0-9]{64}$" },
          "tasks": {
            "type": "array",
            "minItems": 2,
            "maxItems": 2,
            "items": {
              "type": "object",
              "additionalProperties": false,
              "required": ["task_id", "task_sha256", "input_sha256", "answer_key_sha256"],
              "properties": {
                "task_id": { "type": "string", "pattern": "^T[0-9A-Z_-]{2,31}$" },
                "task_sha256": { "type": "string", "pattern": "^[a-f0-9]{64}$" },
                "input_sha256": { "type": "string", "pattern": "^[a-f0-9]{64}$" },
                "answer_key_sha256": { "type": "string", "pattern": "^[a-f0-9]{64}$" }
              }
            }
          }
        }
      }
    }
  }
}
