{
  "schema_version": "2.0",
  "pilot_id": "run-ready-validation-control",
  "study_stage": "feasibility",
  "task_bank_id": "run-ready-validation-task-bank",
  "version": "1.0.0",
  "synthetic_example": false,
  "frozen_at": "2026-09-01T08:30:00Z",
  "frozen_by_role": "Independent validation-control task-bank custodian",
  "blocks": [
    {
      "block_id": "B01",
      "difficulty_stratum": "validation-control matched set 1",
      "block_sha256": "7d1d76c34c16b8b0b5e853020f88ba1dcce9f97221fdffd0b6be8df85d29760f",
      "tasks": [
        {
          "task_id": "T01",
          "task_sha256": "2f2d35c6d35070152ef385a1cafeee46560f0bf8e44e3f7c357e26dd2bfad727",
          "input_sha256": "ab3347a7473dedebf22abf2ae2224a150dfded8a179a44d6042cc9f166a47818",
          "answer_key_sha256": "158c1b7c23c34edc315b634e56b8c505714b62c000eb84798abfeccbb86d2aeb"
        },
        {
          "task_id": "T02",
          "task_sha256": "434046a0bc35ccc97a273a949a1f6217fd80ea0c08a1d5d2456be6214895ecb3",
          "input_sha256": "b68277aa67f6e587565b5dcfdea2f4076a39cb3b319db76e89cad9ad2963a864",
          "answer_key_sha256": "a1d546a1ecbc6fd83650999bc268df65efe5f43ce68763f27737696748e8d868"
        }
      ]
    },
    {
      "block_id": "B02",
      "difficulty_stratum": "validation-control matched set 2",
      "block_sha256": "5dd61b856227b1f79ac17a70c401f75b38d86a9c4cb010aaeed0acb70695cb39",
      "tasks": [
        {
          "task_id": "T03",
          "task_sha256": "4e725950b7f2156c8f8b60be9bef027d0975600070f7b0eb3cb4f0ec4ec91092",
          "input_sha256": "b88de00105a06615428b8d38ee419624139ab3d53826cf0491daf5864405b015",
          "answer_key_sha256": "673a6aee94a467f3762a19900ee58c5392128a2e7f17c18d43ad8b378fc12013"
        },
        {
          "task_id": "T04",
          "task_sha256": "fbd2a887f11148e836f1a51f7d9a4f645ea91fd50b8f59b4d421c29f4d6b831f",
          "input_sha256": "952e966ef04c4d461cebfd58b835f9c6d236ccd75d414d5e9f160ed932496bf1",
          "answer_key_sha256": "7ad8921384911371471a0c900aac86e84c1472d8c53f8b0b3691e92255faaa6d"
        }
      ]
    },
    {
      "block_id": "B03",
      "difficulty_stratum": "validation-control matched set 3",
      "block_sha256": "7aa68c81bd4c85f5d5da4916dea8f7552edd443be2bd167e5730109714ad24dc",
      "tasks": [
        {
          "task_id": "T05",
          "task_sha256": "bb1a37c8bcfec9b7a7043645aff8c87867246e1dce57e693b89d94b948be68e4",
          "input_sha256": "8da640203326a8776106d596a744d745ae2fe1ab381b9c610c3d58228c765af9",
          "answer_key_sha256": "5be4b82545f2c1f3d28cd4489f8fb3eb4b35b944df956330547163841f5c29e8"
        },
        {
          "task_id": "T06",
          "task_sha256": "b47fd558edb9959a2bb2a31bf94100f40126e85b99a0d8de36942a97d680a16a",
          "input_sha256": "8b0ffd08178b17244b8e11b305f5e5ad0de8900460205d4cf0b51728b04ffff5",
          "answer_key_sha256": "99f4818ff94d274478b4fab6cf47587a935560832bfd71b01d3f0b579e454843"
        }
      ]
    }
  ]
}
